{"base_sha":"173e2f7e19049a705bcdaf0269c33a5bd7f70206","child_40_foundation":{"breadth_gate":{"evidence_refs":["docs/evidence/PROGRESSIVE_RUN_CONTROLLER_V1.md"],"gated_by_child":36},"receipt_foundation":{"evidence_refs":["docs/evidence/PROGRESSIVE_ANALYSIS_V1.md"],"gated_by_children":[36,37]}},"children":[{"child_issue":36,"ci_decision":{"exact_head_conclusion":"success","exact_head_run_id":32270143367,"exact_main_conclusion":"success","exact_main_run_id":32270208181},"closed_rationale":null,"depends_on":[],"disposition":"merged","evidence_refs":["docs/evidence/PROGRESSIVE_RUN_CONTROLLER_V1.md","docs/evidence/conveyor/sol-ks-35-state-reconcile-01.json"],"merged_pr":{"base_ref":"main","head_sha":"cf72cb745abe942bafbb758b24b680819dea74b5","merge_sha":"a681f1868f1678c38a46fcd7ca09256edeb4445d","number":41,"protected":true},"release_decision":{"decision":"released","tag":"v0.12.0","tag_sha":"a65e3e7dfe4484fb50c6ad956592892b8bcb1b83"}},{"child_issue":37,"ci_decision":{"exact_head_conclusion":"success","exact_head_run_id":32272856706,"exact_main_conclusion":"success","exact_main_run_id":32272955909},"closed_rationale":null,"depends_on":[36],"disposition":"merged","evidence_refs":["docs/evidence/PROGRESSIVE_ANALYSIS_V1.md","docs/evidence/conveyor/sol-ks-35-state-reconcile-01.json"],"merged_pr":{"base_ref":"main","head_sha":"7d8222ad0d7b9e515ce2e4c747a278f5fbfd947e","merge_sha":"1e12007d9c2094a34abd2d97156943ab6fedb2e2","number":43,"protected":true},"release_decision":{"decision":"released","tag":"v0.13.0","tag_sha":"5c4e919b73a04a2825b5ecfb1b36167e5098296d"}},{"child_issue":38,"ci_decision":{"exact_head_conclusion":"success","exact_head_run_id":32279661221,"exact_main_conclusion":"success","exact_main_run_id":32279763731},"closed_rationale":null,"depends_on":[36,37],"disposition":"merged","evidence_refs":["docs/evidence/SAFE_ANALYSIS_METHOD_PARITY.md","docs/evidence/conveyor/sol-ks-35-state-reconcile-01.json"],"merged_pr":{"base_ref":"main","head_sha":"30fd64397223726759004885be2a30b989397a4b","merge_sha":"70eed40a59e81ef796e0bcb5a552ba64270f8d14","number":45,"protected":true},"release_decision":{"decision":"released","tag":"v0.14.0","tag_sha":"8cad5b979e65d151d583442eed4accd38c40a527"}},{"child_issue":39,"ci_decision":{"exact_head_conclusion":"success","exact_head_run_id":32401150190,"exact_main_conclusion":"success","exact_main_run_id":32401255771},"closed_rationale":null,"depends_on":[36,37,38],"disposition":"merged","evidence_refs":["docs/evidence/ROLES_CLUSTERS_DIFF_V2.md","docs/evidence/conveyor/sol-ks-35-state-reconcile-01.json"],"merged_pr":{"base_ref":"main","head_sha":"00ff853723798cabf9514e35a5f909b1244cddfa","merge_sha":"9cea957fb25938eda7c77b0e92df3989141571e0","number":59,"protected":true},"release_decision":{"decision":"released","tag":"v0.17.0","tag_sha":"8e120496a8685c4abf5fb5d3a0e98adcc8fef16f"}},{"child_issue":40,"ci_decision":{"exact_head_conclusion":"success","exact_head_run_id":33201128462,"exact_main_conclusion":"success","exact_main_run_id":33201173088},"closed_rationale":null,"depends_on":[36,37,38,39],"disposition":"merged","evidence_refs":["docs/evidence/conveyor/sol-ks-35-state-reconcile-01.json"],"merged_pr":{"base_ref":"main","head_sha":"8f592ad5dac358fb3fc0501d83b8c2adfeae299d","merge_sha":"5fee1a92aefa7bdd4cc51da2c324a9cc7ca19cb6","number":123,"protected":true},"release_decision":{"decision":"released","tag":"v0.25.0","tag_sha":"5fee1a92aefa7bdd4cc51da2c324a9cc7ca19cb6"}}],"contract_version":"epic-35-closure/v1","critical_path":[36,37,38,39,40],"epic_issue":35,"head_sha":"d6b9adb5be1e475cdba71c548a71fc900aa3fdff","nonclaims":["This materialized record reports repository, protected-merge, CI, release, and public-readback identifiers only; it authorizes no mutation.","The exact integration range is local main at 173e2f7e19049a705bcdaf0269c33a5bd7f70206 through current origin/main at d6b9adb5be1e475cdba71c548a71fc900aa3fdff.","Issue state prose is not treated as delivery authority; every child disposition is joined to the state reconciliation receipt.","The reviewed closure-tooling artifact at 5ffad599118cade30ce66264d529259f63d1bc45 is not used as the current-main integration head.","The record embeds no source row material, no sensitive material, and no executable query text.","The terminal hash binds the canonical serialization of the record with terminal_hash removed."],"terminal_hash":"bf303ff740bc91f8d05603db2556a60eb83c3d76371b6bade1018787eca28724"}
